{
  "$schema": "https://json-schema.org/draft/2020-12/schema",
  "type": "object",
  "additionalProperties": false,
  "properties": {
    "schema_version": {
      "const": "2.0"
    },
    "video_id": {
      "type": "string",
      "minLength": 1
    },
    "chapter_id": {
      "type": "string",
      "minLength": 1
    },
    "title": {
      "type": "string",
      "minLength": 1
    },
    "purpose": {
      "type": "string",
      "minLength": 1
    },
    "teaching_beat_numbers": {
      "type": "array",
      "minItems": 1,
      "items": {
        "type": "integer",
        "minimum": 1
      },
      "uniqueItems": true
    },
    "visual_spine_indices": {
      "type": "array",
      "minItems": 1,
      "items": {
        "type": "integer",
        "minimum": 1
      },
      "uniqueItems": true
    },
    "cue_ids": {
      "type": "array",
      "items": {
        "type": "string",
        "minLength": 1
      },
      "uniqueItems": true
    },
    "scene_ids": {
      "type": "array",
      "items": {
        "type": "string",
        "minLength": 1
      },
      "uniqueItems": true
    },
    "cache_identity": {
      "type": "string",
      "pattern": "^[0-9a-f]{64}$"
    }
  },
  "required": [
    "schema_version",
    "video_id",
    "chapter_id",
    "title",
    "purpose",
    "teaching_beat_numbers",
    "visual_spine_indices",
    "cue_ids",
    "scene_ids",
    "cache_identity"
  ]
}
