{
  "schema_version": "2.0",
  "video_id": "hybrid-partial",
  "chapter_id": "c02",
  "title": "Worked example: Shared Boolean expression",
  "purpose": "Construct `ex-repeated-subexpression` progressively and orient every entity before analysis.",
  "teaching_beat_numbers": [
    3
  ],
  "visual_spine_indices": [
    1,
    2
  ],
  "cue_ids": [
    "q0009",
    "q0010",
    "q0011",
    "q0012",
    "q0013",
    "q0014"
  ],
  "scene_ids": [
    "s004",
    "s005"
  ],
  "cache_identity": "f0c14e4564ca4fe3a06cfc9607d1c769a5b091d44862020526936526c6b42d6f"
}
