{
  "schema_version": "2.0",
  "video_id": "recognition-c9-c11",
  "chapter_id": "c02",
  "title": "Stable source example and fixed exact arms",
  "purpose": "Construct `ex-recognition-graph` progressively and orient every entity before analysis.",
  "teaching_beat_numbers": [
    3
  ],
  "visual_spine_indices": [
    1,
    2
  ],
  "cue_ids": [
    "q0009",
    "q0010",
    "q0011",
    "q0012",
    "q0013"
  ],
  "scene_ids": [
    "s004",
    "s005"
  ],
  "cache_identity": "9b68c3154ce5918fcd60c8ce8ff9c79c59445526b770da755440c6f01fd2164c"
}
