{
  "schema_version": "2.0",
  "video_id": "recognition-d9",
  "chapter_id": "c02",
  "title": "Worked example: Versioned policy rules",
  "purpose": "Construct `ex-policy-revisions` progressively and orient every entity before analysis.",
  "teaching_beat_numbers": [
    3
  ],
  "visual_spine_indices": [
    1,
    2
  ],
  "cue_ids": [
    "q0009",
    "q0010",
    "q0011",
    "q0012",
    "q0013",
    "q0014",
    "q0015",
    "q0016",
    "q0017",
    "q0018",
    "q0019",
    "q0020",
    "q0021",
    "q0022",
    "q0023",
    "q0024",
    "q0025",
    "q0026",
    "q0027",
    "q0028"
  ],
  "scene_ids": [
    "s004",
    "s005",
    "s006",
    "s007",
    "s008",
    "s009",
    "s010"
  ],
  "cache_identity": "7e81abbda53c67ccbff501b21d742b8b94bdef83351402a5a9564126f3884052"
}
