{
  "schema_version": "2.0",
  "video_id": "circuits",
  "chapter_id": "c04",
  "title": "Boundary, retrieval, and transfer",
  "purpose": "State the limitation, pause for retrieval, repair the misconception, and transfer the lesson.",
  "teaching_beat_numbers": [
    6,
    7,
    8
  ],
  "visual_spine_indices": [
    4
  ],
  "cue_ids": [
    "q0064",
    "q0065",
    "q0066",
    "q0067",
    "q0068",
    "q0069",
    "q0070",
    "q0071"
  ],
  "scene_ids": [
    "s023",
    "s024"
  ],
  "cache_identity": "20be0797cccec0fc83e3ebfef1e7c53ff0cd5ab2738552426df4c0851ccf0c89"
}
